{
  "key": "roadmap-a.w07",
  "title": "Tuần 7: Danh từ đếm được / không đếm được & Lượng từ",
  "weekNumber": 7,
  "orderIndex": 7,
  "description": "Phân biệt Countable vs Uncountable nouns, danh từ số nhiều bất quy tắc và cách dùng Much, Many, A lot of.",
  "lessons": [
    {
      "key": "roadmap-a.w07.l01",
      "title": "Buổi 1: Khái niệm danh từ đếm được và không đếm được",
      "orderIndex": 1,
      "estimatedMinutes": 20,
      "required": true,
      "contentFile": "lessons/w07-l01-countable-uncountable.md",
      "activities": [
        {
          "key": "roadmap-a.w07.l01.a01",
          "title": "Lý thuyết & Kiến thức: Khái niệm danh từ đếm được và không đếm được",
          "type": "READING",
          "required": true,
          "completionPolicy": "MANUAL_CHECK",
          "instructions": "Đọc kỹ phần giải thích, phiên âm IPA Anh-Anh chuẩn và các ví dụ hội thoại trong bài đọc.",
          "skillTags": [
            "reading",
            "theory",
            "grammar"
          ]
        },
        {
          "key": "roadmap-a.w07.l01.a02",
          "title": "Luyện tập thực hành & Ứng dụng",
          "type": "PRACTICE",
          "required": true,
          "completionPolicy": "MANUAL_CHECK_WITH_RESPONSE",
          "instructions": "Vận dụng cấu trúc và từ vựng vừa học để nhập câu trả lời hoặc đoạn văn thực hành vào ô phản hồi bên dưới.",
          "skillTags": [
            "practice",
            "writing"
          ]
        },
        {
          "key": "roadmap-a.w07.l01.a03",
          "title": "Phản tư cuối buổi học",
          "type": "REFLECTION",
          "required": true,
          "completionPolicy": "RESPONSE_SUBMIT",
          "instructions": "Ghi lại 1 điểm quan trọng nhất bạn tâm đắc hoặc một từ vựng / mẫu câu mới bạn sẽ áp dụng ngay hôm nay.",
          "skillTags": [
            "reflection"
          ]
        }
      ]
    },
    {
      "key": "roadmap-a.w07.l02",
      "title": "Buổi 2: Danh từ số nhiều bất quy tắc (people, children, mice)",
      "orderIndex": 2,
      "estimatedMinutes": 20,
      "required": true,
      "contentFile": "lessons/w07-l02-irregular-plurals.md",
      "activities": [
        {
          "key": "roadmap-a.w07.l02.a01",
          "title": "Lý thuyết & Kiến thức: Danh từ số nhiều bất quy tắc (people, children, mice)",
          "type": "READING",
          "required": true,
          "completionPolicy": "MANUAL_CHECK",
          "instructions": "Đọc kỹ phần giải thích, phiên âm IPA Anh-Anh chuẩn và các ví dụ hội thoại trong bài đọc.",
          "skillTags": [
            "reading",
            "theory",
            "grammar"
          ]
        },
        {
          "key": "roadmap-a.w07.l02.a02",
          "title": "Luyện tập thực hành & Ứng dụng",
          "type": "PRACTICE",
          "required": true,
          "completionPolicy": "MANUAL_CHECK_WITH_RESPONSE",
          "instructions": "Vận dụng cấu trúc và từ vựng vừa học để nhập câu trả lời hoặc đoạn văn thực hành vào ô phản hồi bên dưới.",
          "skillTags": [
            "practice",
            "writing"
          ]
        },
        {
          "key": "roadmap-a.w07.l02.a03",
          "title": "Phản tư cuối buổi học",
          "type": "REFLECTION",
          "required": true,
          "completionPolicy": "RESPONSE_SUBMIT",
          "instructions": "Ghi lại 1 điểm quan trọng nhất bạn tâm đắc hoặc một từ vựng / mẫu câu mới bạn sẽ áp dụng ngay hôm nay.",
          "skillTags": [
            "reflection"
          ]
        }
      ]
    },
    {
      "key": "roadmap-a.w07.l03",
      "title": "Buổi 3: Lượng từ: Much, Many, A lot of, Few, Little",
      "orderIndex": 3,
      "estimatedMinutes": 25,
      "required": true,
      "contentFile": "lessons/w07-l03-quantifiers-much-many.md",
      "activities": [
        {
          "key": "roadmap-a.w07.l03.a01",
          "title": "Lý thuyết & Kiến thức: Lượng từ: Much, Many, A lot of, Few, Little",
          "type": "READING",
          "required": true,
          "completionPolicy": "MANUAL_CHECK",
          "instructions": "Đọc kỹ phần giải thích, phiên âm IPA Anh-Anh chuẩn và các ví dụ hội thoại trong bài đọc.",
          "skillTags": [
            "reading",
            "theory",
            "grammar"
          ]
        },
        {
          "key": "roadmap-a.w07.l03.a02",
          "title": "Luyện tập thực hành & Ứng dụng",
          "type": "PRACTICE",
          "required": true,
          "completionPolicy": "MANUAL_CHECK_WITH_RESPONSE",
          "instructions": "Vận dụng cấu trúc và từ vựng vừa học để nhập câu trả lời hoặc đoạn văn thực hành vào ô phản hồi bên dưới.",
          "skillTags": [
            "practice",
            "writing"
          ]
        },
        {
          "key": "roadmap-a.w07.l03.a03",
          "title": "Phản tư cuối buổi học",
          "type": "REFLECTION",
          "required": true,
          "completionPolicy": "RESPONSE_SUBMIT",
          "instructions": "Ghi lại 1 điểm quan trọng nhất bạn tâm đắc hoặc một từ vựng / mẫu câu mới bạn sẽ áp dụng ngay hôm nay.",
          "skillTags": [
            "reflection"
          ]
        }
      ]
    },
    {
      "key": "roadmap-a.w07.l04",
      "title": "Buổi 4: Cụm từ đo lường (a cup of, a bottle of, a slice of)",
      "orderIndex": 4,
      "estimatedMinutes": 20,
      "required": true,
      "contentFile": "lessons/w07-l04-measure-containers.md",
      "activities": [
        {
          "key": "roadmap-a.w07.l04.a01",
          "title": "Lý thuyết & Kiến thức: Cụm từ đo lường (a cup of, a bottle of, a slice of)",
          "type": "READING",
          "required": true,
          "completionPolicy": "MANUAL_CHECK",
          "instructions": "Đọc kỹ phần giải thích, phiên âm IPA Anh-Anh chuẩn và các ví dụ hội thoại trong bài đọc.",
          "skillTags": [
            "reading",
            "theory",
            "grammar"
          ]
        },
        {
          "key": "roadmap-a.w07.l04.a02",
          "title": "Luyện tập thực hành & Ứng dụng",
          "type": "PRACTICE",
          "required": true,
          "completionPolicy": "MANUAL_CHECK_WITH_RESPONSE",
          "instructions": "Vận dụng cấu trúc và từ vựng vừa học để nhập câu trả lời hoặc đoạn văn thực hành vào ô phản hồi bên dưới.",
          "skillTags": [
            "practice",
            "writing"
          ]
        },
        {
          "key": "roadmap-a.w07.l04.a03",
          "title": "Phản tư cuối buổi học",
          "type": "REFLECTION",
          "required": true,
          "completionPolicy": "RESPONSE_SUBMIT",
          "instructions": "Ghi lại 1 điểm quan trọng nhất bạn tâm đắc hoặc một từ vựng / mẫu câu mới bạn sẽ áp dụng ngay hôm nay.",
          "skillTags": [
            "reflection"
          ]
        }
      ]
    },
    {
      "key": "roadmap-a.w07.l05",
      "title": "Buổi 5: Viết danh sách mua sắm thực phẩm hàng ngày",
      "orderIndex": 5,
      "estimatedMinutes": 25,
      "required": true,
      "contentFile": "lessons/w07-l05-shopping-list.md",
      "activities": [
        {
          "key": "roadmap-a.w07.l05.a01",
          "title": "Lý thuyết & Kiến thức: Viết danh sách mua sắm thực phẩm hàng ngày",
          "type": "READING",
          "required": true,
          "completionPolicy": "MANUAL_CHECK",
          "instructions": "Đọc kỹ phần giải thích, phiên âm IPA Anh-Anh chuẩn và các ví dụ hội thoại trong bài đọc.",
          "skillTags": [
            "reading",
            "theory",
            "grammar"
          ]
        },
        {
          "key": "roadmap-a.w07.l05.a02",
          "title": "Luyện tập thực hành & Ứng dụng",
          "type": "PRACTICE",
          "required": true,
          "completionPolicy": "MANUAL_CHECK_WITH_RESPONSE",
          "instructions": "Vận dụng cấu trúc và từ vựng vừa học để nhập câu trả lời hoặc đoạn văn thực hành vào ô phản hồi bên dưới.",
          "skillTags": [
            "practice",
            "writing"
          ]
        },
        {
          "key": "roadmap-a.w07.l05.a03",
          "title": "Phản tư cuối buổi học",
          "type": "REFLECTION",
          "required": true,
          "completionPolicy": "RESPONSE_SUBMIT",
          "instructions": "Ghi lại 1 điểm quan trọng nhất bạn tâm đắc hoặc một từ vựng / mẫu câu mới bạn sẽ áp dụng ngay hôm nay.",
          "skillTags": [
            "reflection"
          ]
        }
      ]
    }
  ]
}