{
  "key": "roadmap-a.w05",
  "title": "Tuần 5: Tương lai đơn (Future Simple) & Be Going To",
  "weekNumber": 5,
  "orderIndex": 5,
  "description": "Biết cách diễn đạt quyết định tức thì, lời hứa với Will và kế hoạch định sẵn với Be Going To.",
  "lessons": [
    {
      "key": "roadmap-a.w05.l01",
      "title": "Buổi 1: Tương lai đơn với Will (quyết định tức thì, lời hứa)",
      "orderIndex": 1,
      "estimatedMinutes": 20,
      "required": true,
      "contentFile": "lessons/w05-l01-future-simple-will.md",
      "activities": [
        {
          "key": "roadmap-a.w05.l01.a01",
          "title": "Lý thuyết & Kiến thức: Tương lai đơn với Will (quyết định tức thì, lời hứa)",
          "type": "READING",
          "required": true,
          "completionPolicy": "MANUAL_CHECK",
          "instructions": "Đọc kỹ phần giải thích, phiên âm IPA Anh-Anh chuẩn và các ví dụ hội thoại trong bài đọc.",
          "skillTags": [
            "reading",
            "theory",
            "grammar"
          ]
        },
        {
          "key": "roadmap-a.w05.l01.a02",
          "title": "Luyện tập thực hành & Ứng dụng",
          "type": "PRACTICE",
          "required": true,
          "completionPolicy": "MANUAL_CHECK_WITH_RESPONSE",
          "instructions": "Vận dụng cấu trúc và từ vựng vừa học để nhập câu trả lời hoặc đoạn văn thực hành vào ô phản hồi bên dưới.",
          "skillTags": [
            "practice",
            "writing"
          ]
        },
        {
          "key": "roadmap-a.w05.l01.a03",
          "title": "Phản tư cuối buổi học",
          "type": "REFLECTION",
          "required": true,
          "completionPolicy": "RESPONSE_SUBMIT",
          "instructions": "Ghi lại 1 điểm quan trọng nhất bạn tâm đắc hoặc một từ vựng / mẫu câu mới bạn sẽ áp dụng ngay hôm nay.",
          "skillTags": [
            "reflection"
          ]
        }
      ]
    },
    {
      "key": "roadmap-a.w05.l02",
      "title": "Buổi 2: Tương lai gần Be Going To (dự định, bằng chứng rõ)",
      "orderIndex": 2,
      "estimatedMinutes": 20,
      "required": true,
      "contentFile": "lessons/w05-l02-be-going-to.md",
      "activities": [
        {
          "key": "roadmap-a.w05.l02.a01",
          "title": "Lý thuyết & Kiến thức: Tương lai gần Be Going To (dự định, bằng chứng rõ)",
          "type": "READING",
          "required": true,
          "completionPolicy": "MANUAL_CHECK",
          "instructions": "Đọc kỹ phần giải thích, phiên âm IPA Anh-Anh chuẩn và các ví dụ hội thoại trong bài đọc.",
          "skillTags": [
            "reading",
            "theory",
            "grammar"
          ]
        },
        {
          "key": "roadmap-a.w05.l02.a02",
          "title": "Luyện tập thực hành & Ứng dụng",
          "type": "PRACTICE",
          "required": true,
          "completionPolicy": "MANUAL_CHECK_WITH_RESPONSE",
          "instructions": "Vận dụng cấu trúc và từ vựng vừa học để nhập câu trả lời hoặc đoạn văn thực hành vào ô phản hồi bên dưới.",
          "skillTags": [
            "practice",
            "writing"
          ]
        },
        {
          "key": "roadmap-a.w05.l02.a03",
          "title": "Phản tư cuối buổi học",
          "type": "REFLECTION",
          "required": true,
          "completionPolicy": "RESPONSE_SUBMIT",
          "instructions": "Ghi lại 1 điểm quan trọng nhất bạn tâm đắc hoặc một từ vựng / mẫu câu mới bạn sẽ áp dụng ngay hôm nay.",
          "skillTags": [
            "reflection"
          ]
        }
      ]
    },
    {
      "key": "roadmap-a.w05.l03",
      "title": "Buổi 3: Phân biệt Will vs Be Going To trong ngữ cảnh",
      "orderIndex": 3,
      "estimatedMinutes": 20,
      "required": true,
      "contentFile": "lessons/w05-l03-will-vs-going-to.md",
      "activities": [
        {
          "key": "roadmap-a.w05.l03.a01",
          "title": "Lý thuyết & Kiến thức: Phân biệt Will vs Be Going To trong ngữ cảnh",
          "type": "READING",
          "required": true,
          "completionPolicy": "MANUAL_CHECK",
          "instructions": "Đọc kỹ phần giải thích, phiên âm IPA Anh-Anh chuẩn và các ví dụ hội thoại trong bài đọc.",
          "skillTags": [
            "reading",
            "theory",
            "grammar"
          ]
        },
        {
          "key": "roadmap-a.w05.l03.a02",
          "title": "Luyện tập thực hành & Ứng dụng",
          "type": "PRACTICE",
          "required": true,
          "completionPolicy": "MANUAL_CHECK_WITH_RESPONSE",
          "instructions": "Vận dụng cấu trúc và từ vựng vừa học để nhập câu trả lời hoặc đoạn văn thực hành vào ô phản hồi bên dưới.",
          "skillTags": [
            "practice",
            "writing"
          ]
        },
        {
          "key": "roadmap-a.w05.l03.a03",
          "title": "Phản tư cuối buổi học",
          "type": "REFLECTION",
          "required": true,
          "completionPolicy": "RESPONSE_SUBMIT",
          "instructions": "Ghi lại 1 điểm quan trọng nhất bạn tâm đắc hoặc một từ vựng / mẫu câu mới bạn sẽ áp dụng ngay hôm nay.",
          "skillTags": [
            "reflection"
          ]
        }
      ]
    },
    {
      "key": "roadmap-a.w05.l04",
      "title": "Buổi 4: Dạng rút gọn 'll và won't chuẩn Anh-Anh",
      "orderIndex": 4,
      "estimatedMinutes": 20,
      "required": true,
      "contentFile": "lessons/w05-l04-contractions-ll-wont.md",
      "activities": [
        {
          "key": "roadmap-a.w05.l04.a01",
          "title": "Lý thuyết & Kiến thức: Dạng rút gọn 'll và won't chuẩn Anh-Anh",
          "type": "READING",
          "required": true,
          "completionPolicy": "MANUAL_CHECK",
          "instructions": "Đọc kỹ phần giải thích, phiên âm IPA Anh-Anh chuẩn và các ví dụ hội thoại trong bài đọc.",
          "skillTags": [
            "reading",
            "theory",
            "grammar"
          ]
        },
        {
          "key": "roadmap-a.w05.l04.a02",
          "title": "Học liệu tham khảo bổ trợ",
          "type": "EXTERNAL_RESOURCE",
          "required": false,
          "completionPolicy": "MANUAL_CHECK",
          "resourceKeys": [
            "res.oxford.phonetics-guide"
          ],
          "instructions": "Mở tài liệu tham khảo chính thống từ BBC Learning English / British Council / Oxford để quan sát thêm ngữ cảnh thực tế.",
          "skillTags": [
            "listening",
            "reference"
          ]
        },
        {
          "key": "roadmap-a.w05.l04.a03",
          "title": "Luyện tập thực hành & Ứng dụng",
          "type": "PRACTICE",
          "required": true,
          "completionPolicy": "MANUAL_CHECK_WITH_RESPONSE",
          "instructions": "Vận dụng cấu trúc và từ vựng vừa học để nhập câu trả lời hoặc đoạn văn thực hành vào ô phản hồi bên dưới.",
          "skillTags": [
            "practice",
            "writing"
          ]
        },
        {
          "key": "roadmap-a.w05.l04.a04",
          "title": "Phản tư cuối buổi học",
          "type": "REFLECTION",
          "required": true,
          "completionPolicy": "RESPONSE_SUBMIT",
          "instructions": "Ghi lại 1 điểm quan trọng nhất bạn tâm đắc hoặc một từ vựng / mẫu câu mới bạn sẽ áp dụng ngay hôm nay.",
          "skillTags": [
            "reflection"
          ]
        }
      ]
    },
    {
      "key": "roadmap-a.w05.l05",
      "title": "Buổi 5: Lập kế hoạch cho kỳ nghỉ sắp tới",
      "orderIndex": 5,
      "estimatedMinutes": 25,
      "required": true,
      "contentFile": "lessons/w05-l05-planning-future.md",
      "activities": [
        {
          "key": "roadmap-a.w05.l05.a01",
          "title": "Lý thuyết & Kiến thức: Lập kế hoạch cho kỳ nghỉ sắp tới",
          "type": "READING",
          "required": true,
          "completionPolicy": "MANUAL_CHECK",
          "instructions": "Đọc kỹ phần giải thích, phiên âm IPA Anh-Anh chuẩn và các ví dụ hội thoại trong bài đọc.",
          "skillTags": [
            "reading",
            "theory",
            "grammar"
          ]
        },
        {
          "key": "roadmap-a.w05.l05.a02",
          "title": "Luyện tập thực hành & Ứng dụng",
          "type": "PRACTICE",
          "required": true,
          "completionPolicy": "MANUAL_CHECK_WITH_RESPONSE",
          "instructions": "Vận dụng cấu trúc và từ vựng vừa học để nhập câu trả lời hoặc đoạn văn thực hành vào ô phản hồi bên dưới.",
          "skillTags": [
            "practice",
            "writing"
          ]
        },
        {
          "key": "roadmap-a.w05.l05.a03",
          "title": "Phản tư cuối buổi học",
          "type": "REFLECTION",
          "required": true,
          "completionPolicy": "RESPONSE_SUBMIT",
          "instructions": "Ghi lại 1 điểm quan trọng nhất bạn tâm đắc hoặc một từ vựng / mẫu câu mới bạn sẽ áp dụng ngay hôm nay.",
          "skillTags": [
            "reflection"
          ]
        }
      ]
    }
  ]
}