{
  "key": "roadmap-a.w16",
  "title": "Tuần 16: Giao tiếp Mua sắm: Hỏi kích cỡ, Giá tiền & Đổi trả",
  "weekNumber": 16,
  "orderIndex": 16,
  "description": "Mẫu câu tìm hàng, hỏi giá tiền (£/pence), phòng thử đồ, chính sách đổi trả hàng và small talk tại quầy thanh toán.",
  "lessons": [
    {
      "key": "roadmap-a.w16.l01",
      "title": "Buổi 1: Tìm kiếm món đồ, hỏi kích cỡ và phòng thử đồ",
      "orderIndex": 1,
      "estimatedMinutes": 20,
      "required": true,
      "contentFile": "lessons/w16-l01-finding-items-sizes.md",
      "activities": [
        {
          "key": "roadmap-a.w16.l01.a01",
          "title": "Lý thuyết & Kiến thức: Tìm kiếm món đồ, hỏi kích cỡ và phòng thử đồ",
          "type": "READING",
          "required": true,
          "completionPolicy": "MANUAL_CHECK",
          "instructions": "Đọc kỹ phần giải thích, phiên âm IPA Anh-Anh chuẩn và các ví dụ hội thoại trong bài đọc.",
          "skillTags": [
            "reading",
            "theory",
            "communication"
          ]
        },
        {
          "key": "roadmap-a.w16.l01.a02",
          "title": "Luyện tập thực hành & Ứng dụng",
          "type": "PRACTICE",
          "required": true,
          "completionPolicy": "MANUAL_CHECK_WITH_RESPONSE",
          "instructions": "Vận dụng cấu trúc và từ vựng vừa học để nhập câu trả lời hoặc đoạn văn thực hành vào ô phản hồi bên dưới.",
          "skillTags": [
            "practice",
            "writing"
          ]
        },
        {
          "key": "roadmap-a.w16.l01.a03",
          "title": "Phản tư cuối buổi học",
          "type": "REFLECTION",
          "required": true,
          "completionPolicy": "RESPONSE_SUBMIT",
          "instructions": "Ghi lại 1 điểm quan trọng nhất bạn tâm đắc hoặc một từ vựng / mẫu câu mới bạn sẽ áp dụng ngay hôm nay.",
          "skillTags": [
            "reflection"
          ]
        }
      ]
    },
    {
      "key": "roadmap-a.w16.l02",
      "title": "Buổi 2: Hỏi giá tiền, bảng Anh (£) và số đếm trong giao dịch",
      "orderIndex": 2,
      "estimatedMinutes": 20,
      "required": true,
      "contentFile": "lessons/w16-l02-prices-british-currency.md",
      "activities": [
        {
          "key": "roadmap-a.w16.l02.a01",
          "title": "Lý thuyết & Kiến thức: Hỏi giá tiền, bảng Anh (£) và số đếm trong giao dịch",
          "type": "READING",
          "required": true,
          "completionPolicy": "MANUAL_CHECK",
          "instructions": "Đọc kỹ phần giải thích, phiên âm IPA Anh-Anh chuẩn và các ví dụ hội thoại trong bài đọc.",
          "skillTags": [
            "reading",
            "theory",
            "communication"
          ]
        },
        {
          "key": "roadmap-a.w16.l02.a02",
          "title": "Luyện tập thực hành & Ứng dụng",
          "type": "PRACTICE",
          "required": true,
          "completionPolicy": "MANUAL_CHECK_WITH_RESPONSE",
          "instructions": "Vận dụng cấu trúc và từ vựng vừa học để nhập câu trả lời hoặc đoạn văn thực hành vào ô phản hồi bên dưới.",
          "skillTags": [
            "practice",
            "writing"
          ]
        },
        {
          "key": "roadmap-a.w16.l02.a03",
          "title": "Phản tư cuối buổi học",
          "type": "REFLECTION",
          "required": true,
          "completionPolicy": "RESPONSE_SUBMIT",
          "instructions": "Ghi lại 1 điểm quan trọng nhất bạn tâm đắc hoặc một từ vựng / mẫu câu mới bạn sẽ áp dụng ngay hôm nay.",
          "skillTags": [
            "reflection"
          ]
        }
      ]
    },
    {
      "key": "roadmap-a.w16.l03",
      "title": "Buổi 3: Chính sách đổi trả hàng hóa (Refund & Exchange)",
      "orderIndex": 3,
      "estimatedMinutes": 25,
      "required": true,
      "contentFile": "lessons/w16-l03-returns-exchanges.md",
      "activities": [
        {
          "key": "roadmap-a.w16.l03.a01",
          "title": "Lý thuyết & Kiến thức: Chính sách đổi trả hàng hóa (Refund & Exchange)",
          "type": "READING",
          "required": true,
          "completionPolicy": "MANUAL_CHECK",
          "instructions": "Đọc kỹ phần giải thích, phiên âm IPA Anh-Anh chuẩn và các ví dụ hội thoại trong bài đọc.",
          "skillTags": [
            "reading",
            "theory",
            "communication"
          ]
        },
        {
          "key": "roadmap-a.w16.l03.a02",
          "title": "Luyện tập thực hành & Ứng dụng",
          "type": "PRACTICE",
          "required": true,
          "completionPolicy": "MANUAL_CHECK_WITH_RESPONSE",
          "instructions": "Vận dụng cấu trúc và từ vựng vừa học để nhập câu trả lời hoặc đoạn văn thực hành vào ô phản hồi bên dưới.",
          "skillTags": [
            "practice",
            "writing"
          ]
        },
        {
          "key": "roadmap-a.w16.l03.a03",
          "title": "Phản tư cuối buổi học",
          "type": "REFLECTION",
          "required": true,
          "completionPolicy": "RESPONSE_SUBMIT",
          "instructions": "Ghi lại 1 điểm quan trọng nhất bạn tâm đắc hoặc một từ vựng / mẫu câu mới bạn sẽ áp dụng ngay hôm nay.",
          "skillTags": [
            "reflection"
          ]
        }
      ]
    },
    {
      "key": "roadmap-a.w16.l04",
      "title": "Buổi 4: Small Talk thân thiện với nhân viên thu ngân",
      "orderIndex": 4,
      "estimatedMinutes": 20,
      "required": true,
      "contentFile": "lessons/w16-l04-cashier-small-talk.md",
      "activities": [
        {
          "key": "roadmap-a.w16.l04.a01",
          "title": "Lý thuyết & Kiến thức: Small Talk thân thiện với nhân viên thu ngân",
          "type": "READING",
          "required": true,
          "completionPolicy": "MANUAL_CHECK",
          "instructions": "Đọc kỹ phần giải thích, phiên âm IPA Anh-Anh chuẩn và các ví dụ hội thoại trong bài đọc.",
          "skillTags": [
            "reading",
            "theory",
            "communication"
          ]
        },
        {
          "key": "roadmap-a.w16.l04.a02",
          "title": "Luyện tập thực hành & Ứng dụng",
          "type": "PRACTICE",
          "required": true,
          "completionPolicy": "MANUAL_CHECK_WITH_RESPONSE",
          "instructions": "Vận dụng cấu trúc và từ vựng vừa học để nhập câu trả lời hoặc đoạn văn thực hành vào ô phản hồi bên dưới.",
          "skillTags": [
            "practice",
            "writing"
          ]
        },
        {
          "key": "roadmap-a.w16.l04.a03",
          "title": "Phản tư cuối buổi học",
          "type": "REFLECTION",
          "required": true,
          "completionPolicy": "RESPONSE_SUBMIT",
          "instructions": "Ghi lại 1 điểm quan trọng nhất bạn tâm đắc hoặc một từ vựng / mẫu câu mới bạn sẽ áp dụng ngay hôm nay.",
          "skillTags": [
            "reflection"
          ]
        }
      ]
    },
    {
      "key": "roadmap-a.w16.l05",
      "title": "Buổi 5: Trải nghiệm mua sắm tại chợ Camden Market",
      "orderIndex": 5,
      "estimatedMinutes": 25,
      "required": true,
      "contentFile": "lessons/w16-l05-flea-market-bargaining.md",
      "activities": [
        {
          "key": "roadmap-a.w16.l05.a01",
          "title": "Lý thuyết & Kiến thức: Trải nghiệm mua sắm tại chợ Camden Market",
          "type": "READING",
          "required": true,
          "completionPolicy": "MANUAL_CHECK",
          "instructions": "Đọc kỹ phần giải thích, phiên âm IPA Anh-Anh chuẩn và các ví dụ hội thoại trong bài đọc.",
          "skillTags": [
            "reading",
            "theory",
            "communication"
          ]
        },
        {
          "key": "roadmap-a.w16.l05.a02",
          "title": "Luyện tập thực hành & Ứng dụng",
          "type": "PRACTICE",
          "required": true,
          "completionPolicy": "MANUAL_CHECK_WITH_RESPONSE",
          "instructions": "Vận dụng cấu trúc và từ vựng vừa học để nhập câu trả lời hoặc đoạn văn thực hành vào ô phản hồi bên dưới.",
          "skillTags": [
            "practice",
            "writing"
          ]
        },
        {
          "key": "roadmap-a.w16.l05.a03",
          "title": "Phản tư cuối buổi học",
          "type": "REFLECTION",
          "required": true,
          "completionPolicy": "RESPONSE_SUBMIT",
          "instructions": "Ghi lại 1 điểm quan trọng nhất bạn tâm đắc hoặc một từ vựng / mẫu câu mới bạn sẽ áp dụng ngay hôm nay.",
          "skillTags": [
            "reflection"
          ]
        }
      ]
    }
  ]
}